description_id,certification_google_data_analytics,other_au,other_azure,other_b,other_business,other_computer_science,other_data_science,other_i,other_ibm_data_science_certificate,other_informatics,other_marketing,other_power,other_strong,other_table,skill_excel,skill_power_bi,skill_python,skill_r,skill_sql,skill_statistics,skill_tableau,salary,title,description,salary_numeric
0,0.0,1.0,0.0,0.0,0.0,0.0,0.0,0.0,0.0,0.0,0.0,0.0,0.0,1.0,0.0,0.0,1.0,0.0,1.0,1.0,0.0,"$90,000 - $110,000",Data Analyst,Bachelor's degree in Statistics or Mathematics required. Strong skills in SQL and Python. Experience with Tableau preferred.,100000.0
1,0.0,0.0,1.0,0.0,0.0,0.0,1.0,0.0,0.0,0.0,0.0,0.0,0.0,0.0,0.0,1.0,1.0,1.0,0.0,0.0,0.0,"$110,000 - $130,000",Senior Data Analyst,Master's in Data Science or similar field. Must have experience with Power BI and Azure. Python and R are essential.,120000.0
2,0.0,0.0,0.0,0.0,1.0,0.0,0.0,0.0,0.0,0.0,0.0,0.0,0.0,0.0,1.0,0.0,1.0,0.0,0.0,0.0,1.0,"$75,000 - $95,000",Business Data Analyst,Bachelor's degree in Business or related field. Proficiency in Excel and Tableau. Knowledge of Python is a plus.,85000.0
3,1.0,0.0,0.0,0.0,0.0,0.0,0.0,0.0,0.0,0.0,0.0,0.0,1.0,0.0,1.0,0.0,0.0,0.0,1.0,0.0,0.0,"$85,000 - $100,000",Data Analyst,Google Data Analytics certification preferred. Strong Excel and SQL required. Bachelor's degree desired.,92500.0
4,0.0,0.0,0.0,0.0,0.0,0.0,0.0,0.0,0.0,0.0,0.0,0.0,0.0,0.0,1.0,1.0,1.0,0.0,0.0,0.0,0.0,"$65,000 - $80,000",Junior Data Analyst,"Bachelor’s degree or certification in analytics. Experience with Python, Excel, and Power BI.",72500.0
5,0.0,0.0,0.0,0.0,0.0,1.0,0.0,0.0,1.0,0.0,0.0,0.0,0.0,0.0,0.0,0.0,1.0,0.0,1.0,0.0,0.0,"$95,000 - $115,000",Data Analyst,"IBM Data Science Certificate, Bachelor's in Computer Science, strong skills in SQL, Python, and statistics.",105000.0
6,0.0,0.0,0.0,1.0,0.0,0.0,0.0,1.0,0.0,0.0,1.0,1.0,0.0,0.0,0.0,0.0,0.0,0.0,0.0,0.0,1.0,"$70,000 - $90,000",Marketing Data Analyst,Bachelor's degree in Marketing or Statistics. Familiarity with data visualization tools like Tableau and Power BI.,80000.0
7,0.0,0.0,0.0,0.0,0.0,0.0,0.0,0.0,0.0,1.0,0.0,0.0,0.0,1.0,1.0,0.0,1.0,0.0,1.0,0.0,0.0,"$105,000 - $125,000",Healthcare Data Analyst,"Master's degree in Health Informatics. Required skills: Python, SQL, Excel. Preferred: R, Tableau.",115000.0
